{
  "$schema": "http://json-schema.org/draft-07/schema#",
  "title": "User",
  "type": "object",
  "required": ["id", "name", "email", "age", "role"],
  "$defs": {
    "Address": {
      "type": "object",
      "required": ["street", "city"],
      "properties": {
        "street": { "type": "string", "minLength": 1 },
        "city":   { "type": "string", "minLength": 1 },
        "zip":    { "type": "string", "pattern": "^\\d{5}$" }
      },
      "additionalProperties": false
    }
  },
  "properties": {
    "id": {
      "type": "integer",
      "minimum": 1
    },
    "name": {
      "type": "string",
      "minLength": 2,
      "maxLength": 100
    },
    "email": {
      "type": "string",
      "format": "email"
    },
    "age": {
      "type": "integer",
      "minimum": 0,
      "maximum": 150
    },
    "role": {
      "type": "string",
      "enum": ["admin", "user", "guest"]
    },
    "website": {
      "type": "string",
      "format": "uri"
    },
    "tags": {
      "type": "array",
      "items": { "type": "string" },
      "uniqueItems": true,
      "maxItems": 10
    },
    "address": { "$ref": "#/$defs/Address" },
    "score": {
      "type": "number",
      "minimum": 0,
      "maximum": 100,
      "multipleOf": 0.5
    },
    "metadata": {
      "type": "object",
      "additionalProperties": { "type": "string" }
    }
  },
  "additionalProperties": false
}
